"title","brand","description","starsBreakdown/3star","starsBreakdown/4star","starsBreakdown/5star","reviewsCount","price","price/currency","price/value","categoryPageData/productPosition"
"Shemira 24 Packs Valentine's Day Cards for Kids with Flower Bouquet Building Blocks, School Classroom Valentine's Gifts Exchange, Valentine's Party Favors for Kids, Valentine's Gift Cards Bulk","Shemira",,"0","0","1","1",,"$","9.99","203"
"DENIMOMO Valentines Day Rose Flowers Gifts for Her,Forever Preserved Roses in Glass Dome, Anniversary Birthday Real Roses Gifts for Women Wife Mom Girlfrien/Purple","DENIMOMO",,"0.06","0.11","0.79","178",,"$","49.99","290"
"YWHL Gifts for Wife with Colorful LED Base I Love You Gifts for Her from Husband Best Anniversary Birthday Wife Gift Ideas Romantic to My Wife Crystal Keepsakes Presents for Valentine's Day Christmas","YWHL",,"0.03","0.09","0.84","854",,"$","37.99","297"
"Dabney Lee Mailbox for Valentines Day Gifts - Mini Mailbox Tin for Party Favors, Classroom Prize Supplies - Valentine Mailbox for Exchange Gifts and Greeting Cards","Designstyles",,"0","0","0","2",,"$","12.99","295"
"Valentines Day Gifts for Kids - 32 Pcs Valentines Crazy Straws Cards Gifts Reusable Straws for Kids, Valentines Day Cards for Kids Classroom Exchange Party Favor","mayace","Package Included: 32 x Valentine crazy drinking straws 32 x Valentine cards Valentine Cards Size: 13 x 6.8 cm/ 5.12 x 2.68 inches Valentine Straws Size: 10.6 inches How To Use: 1. Choose a straw and cross it to a card; 2. Fill in 'From' and 'To'; 3. Then you can give them out to anyone you like.  Ideal Valentine Day Gifts:  Best for children's Valentine's Day, classroom exchange activities, gift exchange between friends, children's Valentine's Day party favors, and the best kit as a prize for kids.","0.11","0.15","0.62","26",,"$","11.99","294"
"LWBDD 13"" Valentines Day Gift Bags 2 Pcs with Tissue Paper, valentine bag bulk for Birthday/Mother's day/Father's day (LOVE)","LWBDD","2 Piece White Love Gift Bag for Valentine's Day Mother's Day and Father's Day Birthday Party","0","0.08","0.84","18",,"$","3.99","293"
"J'FLORU Valentine’s Day Gifts,6 Pack Valentine’s Day Picks Berry Stems with Pink Hearts for Valentine’s Day Decor Anniversary Wedding Decorations(Pink)","J'FLORU","6 Pack Artificial Valentine’s Day Gifts-Berry Picks with Pink Hearts-17in Features: -Handmade with high-quality materials.Romantic and lasting. -Packed in cardboard box to avoid extrusion and deformation. -Perfect vase filler and great addition Valentine’s Day decor. Details: -Materials: Foam,Plastic,Iron. -Size: 17 inches tall. -Package: 6 *Valentine’s Day Picks. Note: If you have any questions about our products, please feel free to contact us. We will reply in time.","0","0.07","0.83","38",,"$","9.99","301"
"Valentines Day Gifts: I Spy Valentine's Day Book For Kids Ages 2-6: Unleash Your Little One's Imagination with the Exciting I Spy Valentine's ... ... Activity Book (Valentines day gift ideas)",,,"0","0","0.5","2",,"$","7.98","304"
"Cheerin Valentines Day Card with Envelope - Funny Valentines Cards for Men - Romantic Cards - Anniversary Card for Him - Appreciation Gifts for Husband - Hilarious Gag Gifts for Boyfriend Fiance","Cheerin",,"0.02","0.05","0.93","847",,"$","6.99","299"
"JOYIN 28 Packs Valentine's Day Gift Cards with Flashing LED Bracelets for Valentine Light Up Party Favor Toy, Valentine's Classroom Gift Exchange, Kids and Adults, Glow Accessories","JOYIN",,"0.14","0.17","0.55","30",,"$","22.99","305"
"THEMEROL Natural Gemstone Bracelet Gifts for Daughter Mom Sister Niece Aunt Wife Girlfriend Grandma","THEMEROL",,"0.03","0.07","0.87","140",,,,"300"
"Juegoal 28 Pack Valentines Day Gift Cards for Kids with Animal Plush Toys, Stress Relief Toy Animal Keychain Set, Valentines Party Favor Classroom Gift Exchange Supplies Bulk Game Prizes","Juegoal",,"0.05","0.16","0.68","113",,"$","21.99","296"
"Double Couple Gift for Mom Women-Rose Cute Bear - Rose Adorable Teddy Artificial Bear - Best Gift for Valentines Day, Mothers Day, Anniversary, Birthdays - Clear Gift Box Included! 10 Inches Tall","Double Couple",,"0.06","0.15","0.72","347",,"$","19.59","298"
"Valentine's Day Gifts For Her - Rose in Glass Dome Beauty and The Beast Rose - Rose in a Glass Mom Gifts Birthday Gifts Wedding Anniversary Decorations - Glass Rose | Rose with Dome | Rose Glass Dome","Norcalway",,"0.04","0.1","0.81","423",,"$","23.97","310"
